<?xml version="1.0" encoding="UTF-8"?>
<website xmlns:xsi="http://www.w3.org/2001/XMLSchema-instance"
         xsi:noNamespaceSchemaLocation="PROJEKTXSD.xsd">
	<topic>
		<title>My Hobby</title>
		<author>
			<name>Oskar</name>
			<surname>Kłos</surname>
			<studentid>203708</studentid>
		</author>
	</topic>
	<content>
		<introduction>
			<headline>Introduction</headline>
			<description> Welcome to my website! Here, I share my passion for timeless music from the '70s, '80s, and '90s. </description>
			<aboutlist> Bands Artists Songs Biographies </aboutlist>
		</introduction>
		<favouritebands>
			<band rank="1" name="Michael Jackson" performer="solo">
				<description>Michael Jackson (1958–2009), often referred to as the "King of Pop," was an American singer, songwriter, and dancer.</description>
			</band>
			<band rank="2" name="The Beatles" performer="band">
				<description>The Beatles were an iconic British rock band formed in Liverpool in 1960, consisting of John Lennon, Paul McCartney, George Harrison, and Ringo Starr.</description>
			</band>
			<band rank="3" name="Queen" performer="band">
				<description>Queen, formed in London in 1970, is a legendary British rock band known for their theatrical performances and genre-blending music.</description>
			</band>
			<band rank="4" name="Madonna" performer="solo">
				<description>Madonna, often called the "Queen of Pop," is a globally recognized artist known for her groundbreaking influence on music, fashion, and pop culture.</description>
			</band>
			<band rank="5" name="Nirvana" performer="band">
				<description>Nirvana was an American rock band formed in 1987 in Aberdeen, Washington, by Kurt Cobain and Krist Novoselic.</description>
			</band>
		</favouritebands>
		<favouritesongs>
			<topsongs>
				<song rank="1" title="Earth Song" artist="Michael Jackson"/>
				<song rank="2" title="Forever Young" artist="Alphaville"/>
				<song rank="3" title="Killing Me Softly with His Song" artist="Fugees, Ms. Lauryn Hill"/>
				<song rank="4" title="Wonderwall" artist="Oasis"/>
				<song rank="5" title="All I Want for Christmas Is You" artist="Mariah Carey"/>
			</topsongs>
		</favouritesongs>
	</content>
	<gallery>
		<photos>
			<photo source="./widownia.jpg" label="Concert Audience"/>
			<photo source="./artist.jpg" label="The top 5 artist"/>
			<photo source="./band.jpg" label="The top 5 band"/>
		</photos>
	</gallery>
	<links>
		<link source="https://www.w3schools.com/html/" label="HTML w3schools"/>
		<link source="https://www.w3schools.com/xml/default.asp" label="XML w3schools"/>
		<link source="https://enauczanie.pg.edu.pl/moodle/" label="Moodle website"/>
	</links>
	<survey>
		<question id="q1">
			<text>Who is you favourite artist?</text>
			<response type="text"/>
		</question>
		<question id="q2">
			<text>What is your favourite band?</text>
			<response type="text"/>
		</question>
		<question id="q3">
			<text>How old are you?</text>
			<response type="numeric"/>
		</question>
		<question id="q4">
			<text>Do you like my website?</text>
			<response type="selection"/>
		</question>
	</survey>
	<menu>
		<option id="o1" reference="top">Go back to top</option>
		<option id="o2" reference="favouritebands">Top 5 Bands and Artists</option>
		<option id="o3" reference="favouritesongs">Top 5 Songs</option>
		<option id="o4" reference="survey">Survey</option>
	</menu>
</website>